id,subreddit,title,score,num_comments,body,url,created
y2rmc0,u_Apadana21,Tales of bloody Iran protest crackdown at border crossing,1,0,"&#x200B;

[ ](https://preview.redd.it/lkc2xrtyqit91.png?width=976&format=png&auto=webp&s=becbe76854a21898fc7ab5f25d1f358436e3949a)

[Soran raises two fingers to his left temple and motions firing a gun. “If you talk, they will put a bullet in your head,” he tells me.](https://apadanamedia.org/tales-of-bloody-iran-protest-crackdown-at-border-crossing/)

Around us, the Iranian mountains reach skywards. We’re at a bus station in Penjwen, a town in Iraq’s northern Kurdistan region that is close to the crossing post on the border with Iran. Cars sporadically pull in and discharge their occupants into the dusty courtyard. Some pause and drink tea, while others climb straight into the small minibuses that’ll take them to the nearby Iraqi city of Sulaimaniya.",https://www.reddit.com/r/u_Apadana21/comments/y2rmc0/tales_of_bloody_iran_protest_crackdown_at_border/,1665643388.0
xwgz0t,ThisCelebrity,"Marion Cotillard, Isabelle Huppert & More Cut Hair in Iran Protest",2,0,,https://www.justjared.com/2022/10/05/marion-cotillard-isabelle-huppert-more-cut-hair-in-iran-protest/,1664991354.0
y37lkm,u_VoteOurVoice,"One month after Mahsa Amini’s arrest, Iran protest deaths top 100.",1,0,,https://www.france24.com/en/middle-east/20221013-one-month-after-mahsa-amini-s-arrest-iran-protests-take-deadly-toll,1665689426.0
y1yy3o,whatsnewtoday,Tales of bloody Iran protest crackdown at border crossing,2,1,,https://www.bbc.com/news/world-middle-east-63218963,1665565822.0
xnjgkx,russiawarinukraine,The genesis of Iran protest (Video),6,1,,https://news247gh.com/the-genesis-of-iran-protest-video-mahsa-amini/,1664100811.0
yatunk,NoFilterNews,/r/worldnews - https://www.dw.com/en/iran-protest-in-berlin-draws-thousands/a-63527862,1,0,"/r/worldnews
   
 https://www.dw.com/en/iran-protest-in-berlin-draws-thousands/a-63527862",https://www.reddit.com/r/NoFilterNews/comments/yatunk/rworldnews/,1666460526.0
y1vmtb,u_us_alarm,Tales of bloody Iran protest crackdown at border crossing - BBC,1,0,,https://www.bbc.com/news/world-middle-east-63218963,1665553966.0
y1ks2l,Oscars_SF,"Laura Poitras, Aurélia Petit Join Iran Protest at London Film Festival",1,0,,https://variety.com/2022/film/global/laura-poitras-aurelia-petit-iran-protest-bfi-london-film-festival-1235398920/,1665523220.0
