id,subreddit,title,score,num_comments,body,url,created
xnx07i,worldnews,Iran protests Western stance on mass protests over woman's death,4104,289,,https://www.reuters.com/world/middle-east/iran-summons-uk-norwegian-envoys-unrest-persists-2022-09-25/,1664135107.0
xnx07i,worldnews,Iran protests Western stance on mass protests over woman's death,4104,289,,https://www.reuters.com/world/middle-east/iran-summons-uk-norwegian-envoys-unrest-persists-2022-09-25/,1664135107.0
xn467s,PublicFreakout,Iran protest compilation from day 1,301,18,,https://v.redd.it/2m6rk1uxgvp91,1664053856.0
y0bkb7,nextfuckinglevel,Brave and defiant hijabless young woman offers “Free hugs for the grieving people of Iran” today in Kermanshah. Demonstrations and civil disobedience against the Islamic Republic continues in different shapes and places on day 24 of iran protests.,2123,59,,https://v.redd.it/bakp5436kys91,1665398841.0
xkvwe4,u_No_Secretary4988,#iran #protest #irgc,20,0,,https://i.redd.it/tuiwvsb8idp91.jpg,1663836365.0
xji0vt,AbruptChaos,"Here is a dragon kick ""Iran protest""",843,44,,https://v.redd.it/hrvz8blle2p91,1663701998.0
xtydk2,PublicFreakout,Iran protests: a child shot in Bukan,302,36,,https://v.redd.it/kkey6oxj8gr91,1664741133.0
xyujl5,PublicFreakout,Another 16 year old killed in Iran protests,7404,481,,https://v.redd.it/1lkznf09gls91,1665240314.0
xt35fl,ProIran,Anti-Iran protest turns violent as they accuse people of being spies 😅🤣,15,7,,https://v.redd.it/hb0ywq6eq8r91,1664650437.0
y1vfxu,bollywoodmemes,"Indian Actress Joins Iran protest, On Instagram against - TODAY FACTS",79,27,,https://i.redd.it/7ti7wuiibbt91.jpg,1665553294.0
y0zps6,u_Artistic-Owl-1048,Iran Protest Male Supporter Killed,3,0,,https://v.redd.it/fcbzpv3tu3t91,1665462929.0
xkcvkn,pics,"A woman argues with Basij militia members after removing her hijab during Iran protests, #MahsaAmini",32297,938,,https://i.redd.it/rmrbzyea99p91.jpg,1663785005.0
yat3zx,worldnews,"Iran protest in Berlin draws thousands | 80,000 people gathered in Berlin to show solidarity with the demonstrations in Iran. Meanwhile, shopkeepers and factory workers went on strike in several Iranian cities.",1986,36,,https://www.dw.com/en/iran-protest-in-berlin-draws-thousands/a-63527862,1666458679.0
y9wtrc,worldnews,"Almost 12,500 people arrested in Iran protest crackdown, says rights group | Iran",1224,32,,https://www.theguardian.com/world/2022/oct/21/arrests-iran-protest-crackdown-plight-thousands-in-jail,1666366623.0
ya3mv8,news,"Almost 12,500 people arrested in Iran protest crackdown, says rights group | Iran",541,17,,https://www.theguardian.com/world/2022/oct/21/arrests-iran-protest-crackdown-plight-thousands-in-jail,1666383629.0
y7nnht,GenUsa,Dang CIA is busy with the Iran protest and now Tunisians protest!1!!1!,234,19,,https://v.redd.it/0pgb1cqfpnu91,1666139104.0
y1jlk7,vexillology,"my version of the iran protest flag, with the iranian lion holding a rose, common flower used by iranians to honour the memory of Mahsa Amini",364,29,,https://i.redd.it/34uix2bck8t91.png,1665520388.0
xhko1s,exmuslim,Women in Iran protest the killing of Mahsa Amini by removing their hijabs.,1878,179,,https://v.redd.it/u8myl4tn5no91,1663517389.0
xm551c,Feminism,I took inspiration from the Iran protest signs to make this 💛 (I can email you the Krita file if anyone is interested),955,22,,https://i.redd.it/pdk5ad3sgnp91.png,1663957292.0
yat9cy,pics,Iran Protest in Berlin,177,8,,https://i.redd.it/chd77w4t4ev91.jpg,1666459054.0
ya2gs7,Sacramento,solidarity w Iran protest tomorrow (10/22) at 12,66,16,,https://i.redd.it/p3lhezlzn7v91.png,1666380748.0
xv45f3,worldnews,Swiss police violently disperse anti-Iran protest at embassy,142,19,,https://us.yahoo.com/news/swiss-police-violently-disperses-anti-095819904.html,1664854150.0
xj2qez,JordanPeterson,Iran protest 2022 please be our voice #MahsaAmini,54,27,,https://twitter.com/jonathanofrivia/status/1572106213550338049?t=dmGdfEFYLeG5hlEVxrYKug&s=34,1663661029.0
xsvnb4,pics,"Iran Protest, Isfahan city, Today",524,20,,https://i.redd.it/45b869d977r91.jpg,1664631731.0
xpd19i,worldnews,Iran protest death toll tops 75 - human rights group,455,15,,https://www.i24news.tv/en/news/middle-east/iran-eastern-states/1664216935-iran-protest-death-toll-tops-75-human-rights-group,1664274840.0
xu2iyg,ProIran,Yasmin Pahlavi joins Anti-Iran protest crowd chants death to shah,23,14,,https://v.redd.it/ng1j6z7f3hr91,1664751524.0
yd7tjc,socialism,Iran Protest Map,36,11,,https://twitter.com/redfishstream/status/1584923496345632770?s=20&t=iWyYud3k26Eo9nlJ1SQr9g,1666712248.0
yfrvpb,NonCredibleDiplomacy,Tripped acid in D.C last weekend and got caught in an Iran protest,64,4,,https://v.redd.it/g6d6ifpkikw91,1666972177.0
xpsoye,vancouver,Oct 1st global day for inaction in Iran protest,8,37,Anyone know where and when protest in vancouver on Oct 1st for woman in Iran??,https://www.reddit.com/r/vancouver/comments/xpsoye/oct_1st_global_day_for_inaction_in_iran_protest/,1664312771.0
yd7w4h,iranian,New Iran Protest Map,10,3,,https://twitter.com/redfishstream/status/1584923496345632770?s=20&t=iWyYud3k26Eo9nlJ1SQr9g,1666712429.0
yd7rs0,Anarchism,Iran protest map,43,2,,https://twitter.com/redfishstream/status/1584923496345632770?s=20&t=iWyYud3k26Eo9nlJ1SQr9g,1666712123.0
xzhsud,worldnews,‘Not afraid anymore’: Iran protests enter fourth week - Workers went on strike and street clashes erupted across the country,48737,1093,,https://www.aljazeera.com/news/2022/10/8/not-afraid-anymore-clashes-as-iran-protests-enter-fourth-week,1665309457.0
y9wu1c,NewIran,"Almost 12,500 people arrested in Iran protest crackdown, says rights group | Iran",42,2,,https://www.theguardian.com/world/2022/oct/21/arrests-iran-protest-crackdown-plight-thousands-in-jail,1666366642.0
xz03i6,SantaMonica,Iran protest on 3rd St Promenade,55,9,,https://v.redd.it/ip08dqi6mms91,1665254207.0
xz2pur,Damnthatsinteresting,Shervin haji agha poor song for Iran protest line art animation by(me),34,7,,https://v.redd.it/8w9xopqg4ns91,1665260800.0
xnw9eb,worldnews,French police use tear gas to thwart Iran protest in Paris,149,11,,https://www.lemonde.fr/en/france/article/2022/09/25/french-police-use-tear-gas-to-thwart-iran-protest-in-paris_5998185_7.html,1664133365.0
xxxfj3,worldnews,Iran protests: Nika Shakarami's mother says her daughter was murdered,41724,1271,,https://www.bbc.co.uk/news/world-middle-east-63170486,1665144515.0
yfub2x,ProIran,Shabzadeh participating in Pro-Iran protest against rioters,13,0,,https://v.redd.it/xo100o89wkw91,1666976834.0
y019p2,worldnews,Iran Protests: Security Forces Raid Girl's Schools and Arrest Pupils,5917,310,,https://iranwire.com/en/politics/108442-iran-protests-security-forces-raid-girls-schools-and-arrest-pupils/,1665363286.0
xlhe0k,technology,#IranProtests: Signal is blocked in Iran. You can help people in Iran reconnect to Signal by hosting a proxy server.,46479,905,,https://signal.org/blog/run-a-proxy/,1663890607.0
xkwgk0,Windscribe,Iran protest & windscribe performance,22,9,"as you may probably know, heavy protest is happening in iran against islamic regime and mandatory hijab law for days and windscribe was working flawlessly until yesterday, but this morning i've had serious problem connecting via android and windows but on android, wireguard did the job for now its good and on windows, Wstunnel did the trick. that's it, i wanted to thank windscribe team and inform its user of its performance in a very restricted (not very sophisticated in my opinion) network environment. also Need to mention all other connecting mode failed this morning.",https://www.reddit.com/r/Windscribe/comments/xkwgk0/iran_protest_windscribe_performance/,1663838391.0
xzs1q1,PublicFreakout,Iran protest over the killing of Mahsa Amini,19,2,,https://youtu.be/qEzAjhe2Prc,1665338735.0
xi3oja,wholesome,Women in Iran protest the killing of Mahsa Amini by removing their hijabs.,176,2,,https://v.redd.it/u8myl4tn5no91,1663567767.0
xnxm7f,soccer,"Sardar Azmoun, Iran’s star forward, posted this in solidarity to the recent Iran protests.",11133,447,"Translation: “Due to the rules  of the National Team, we were not allowed to say anything until the conclusion of our current training camp, but I am no longer able to tolerate silence. If they want to cut me from the team it is the sacrifice for a single strand of hair on an Iranian women. Their is no way this post will be erased. Shame on all you how easily murder people. Long love the Iranian women”.",https://i.redd.it/7dyvbmqra2q91.jpg,1664136531.0
ya67mu,theworldnews,"Almost 12,500 people arrested in Iran protest crackdown, says rights group | Iran",4,0,,https://www.theguardian.com/world/2022/oct/21/arrests-iran-protest-crackdown-plight-thousands-in-jail,1666390055.0
xundmb,WomenInNews,"World joins Iran Protest for ""Women, Life, Freedom,"" but Patriarchy is Fighting Back",21,0,,https://www.juancole.com/2022/10/freedom-patriarchy-fighting.html,1664812813.0
xmuprq,Wallstreetsilver,Iran protest threads,53,7,"If it didn't strike you as odd that Iran is suddenly protesting for muh freedom and women's rights shortly after Ukraine started complaining about them being friendly to Russia, then you lack basic pattern recognition and you're not gonna make it (NGMI).",https://www.reddit.com/r/Wallstreetsilver/comments/xmuprq/iran_protest_threads/,1664030746.0
xzrt2t,LGBT_Muslims,Iran protest for killing of Masha amini,13,0,,https://youtu.be/qEzAjhe2Prc,1665338146.0
xv037x,StrikeForRoe,"World joins Iran Protest for ""Women, Life, Freedom,"" but Patriarchy is Fighting Back",153,1,,https://www.juancole.com/2022/10/freedom-patriarchy-fighting.html,1664842918.0
yamrd3,cork,Iran protest,1,6,"Was wondering if that was today and what time was it starting?
How big a protest will it end up being",https://www.reddit.com/r/cork/comments/yamrd3/iran_protest/,1666442459.0
xzriw2,BreadTube,Iran protest over the killing of Mahsa Amini,22,0,,https://youtu.be/qEzAjhe2Prc,1665337411.0
xzs7i5,Bad_Cop_No_Donut,Iran protest killing of Mahsa Amini from local police,24,1,,https://youtu.be/qEzAjhe2Prc,1665339136.0
yesi28,IranRevolutionReport,New Iran Protest Map,5,0,,https://i.redd.it/ccasimrfscw91.jpg,1666878650.0
yaya33,Viral_Trends,Iran Protest in Berlin,2,0,,https://viraltiger.org/images/iran-protest-berlin,1666471851.0
y1ojzo,NewIran,Tales of bloody Iran protest crackdown at border crossing,10,0,,https://www.bbc.co.uk/news/world-middle-east-63218963,1665532962.0
y9iktz,SeenOnNews_longtail,Teenage boy shot dead at Iran protest [#33|+245|c8],1,2,,https://www.bbc.com/news/world-middle-east-63328086.amp,1666323050.0
y1ud9e,DailyReport,Tales of bloody Iran protest crackdown at border crossing,2,0,,https://www.bbc.com/news/world-middle-east-63218963,1665549801.0
ya6kyp,NewIran,"50,000 registered for Iran protest in Berlin this weekend",1,0,,"https://thelevantnews.com/en/article/50,000-registered-for-iran-protest-in-berlin-on-weekendoctober-19,-2022,-3:51-pm",1666391027.0
yaupnx,trendinghot,Iran Protest in Berlin,1,0,,https://www.reddit.com/r/pics/comments/yat9cy/iran_protest_in_berlin/?utm_source=ifttt,1666462715.0
xk8rp7,AskMiddleEast,Thoughts on Iran protest,0,8,"

[View Poll](https://www.reddit.com/poll/xk8rp7)",https://www.reddit.com/r/AskMiddleEast/comments/xk8rp7/thoughts_on_iran_protest/,1663775805.0
ya81rr,sac_events,solidarity w Iran protest tomorrow (10/22) at 12,1,0,,https://i.redd.it/p3lhezlzn7v91.png,1666394984.0
yf7kcp,phnewsfeed,Iran protest deaths mount as Tehran vows ‘severe response’ to shrine massacre,1,0,,https://newsinfo.inquirer.net/1686042/iran-protest-deaths-mount-as-tehran-vows-severe-response-to-shrine-massacre,1666914849.0
xvu44d,worldanarchism,[Iran] (Video) Soundtrack for a revolution: Iran protest song that's become the soundtrack to civil uprising – video | The Guatdian,2,1,,https://www.theguardian.com/world/video/2022/oct/04/iran-protest-song-shervin-hajiour-soundtrack-civil-uprising-video,1664926150.0
xzs9e5,BlackLGBT,Iran protest the killing of Mahsa Amini,14,0,,https://youtu.be/qEzAjhe2Prc,1665339270.0
yb044e,theworldnews,"Iran protest in Berlin draws thousands | 80,000 people gathered in Berlin to show solidarity with the demonstrations in Iran. Meanwhile, shopkeepers and factory workers went on strike in several Iranian cities.",3,0,,https://www.dw.com/en/iran-protest-in-berlin-draws-thousands/a-63527862,1666476531.0
ya0sff,globalworldnews,"Almost 12,500 people arrested in Iran protest crackdown, says rights group",1,0,,https://www.theguardian.com/world/2022/oct/21/arrests-iran-protest-crackdown-plight-thousands-in-jail,1666376667.0
y1sdyh,NewIran,Tales of bloody Iran protest crackdown at border crossing,4,0,,https://www.bbc.com/news/world-middle-east-63218963,1665543807.0
yb4g1n,u_us_alarm,Thousands honor Jina Mahsa Amini at Iran protest in Berlin - DW (English),1,0,,https://www.dw.com/en/thousands-honor-jina-mahsa-amini-at-iran-protest-in-berlin/a-63527862,1666488515.0
yav6am,NoFilterNews,/r/news - https://dw.com/en/iran-protest-in-berlin-draws-thousands/a-63527862,1,0,"/r/news
   
 https://dw.com/en/iran-protest-in-berlin-draws-thousands/a-63527862",https://www.reddit.com/r/NoFilterNews/comments/yav6am/rnews/,1666463883.0
yb3gn5,u_Far-Glass,Thousands honor Jina Mahsa Amini at Iran protest in Berlin - DW (English),1,0,,https://www.dw.com/en/thousands-honor-jina-mahsa-amini-at-iran-protest-in-berlin/a-63527862,1666485661.0
y9y3k7,autotldr,"Almost 12,500 people arrested in Iran protest crackdown, says rights group | Iran",1,0,"This is the best tl;dr I could make, [original](https://www.theguardian.com/world/2022/oct/21/arrests-iran-protest-crackdown-plight-thousands-in-jail) reduced by 85%. (I'm a bot)
*****
> Almost 12,500 people have been arrested and nearly 250 killed since the street protests began in Iran, according to a prominent human rights group, with thousands of anxious families struggling to make contact with loved ones who have gone missing and presumed to be in jail.

> As many as 200 refinery workers have been arrested since their protests started a fortnight ago.

> The Centre for Human Rights in Iran said 3,000 had been arrested in Tehran province alone, of which 835 remained in jail including 200 university students.

> Mohammad Mehdi Esmaili, the minister of guidance, said the number of journalists that remained under arrest was not high, but according to the International Federation of Journalists, 24 have been arrested since the protests started with 11 being held in Evin prison.

> In one case seen as typical, Maryam Mazrouei, a journalist and a well-known news photographer, has twice been arrested, and was apparently released on Thursday after 12 days in detention.

> Security forces arrested writer and journalist Mandana Sadeghi and her husband, Reza Mohammadi, at their house in Abadan.


*****
[**Summary Source**](https://smmry.com/https://www.theguardian.com/world/2022/oct/21/arrests-iran-protest-crackdown-plight-thousands-in-jail) | [FAQ](http://autotldr.io/ ""606794 summaries so far."") | [Feedback](http://www.reddit.com/message/compose?to=%23autotldr ""PM's and comments are monitored, constructive feedback is welcome."") | *Top* *keywords*: **arrest**^#1 **protests**^#2 **people**^#3 **journalist**^#4 **security**^#5

Post found in [/r/worldnews](http://np.reddit.com/r/worldnews/comments/y9wtrc/almost_12500_people_arrested_in_iran_protest/), [/r/worldnews](http://np.reddit.com/r/worldnews/comments/y9wtrc/almost_12500_people_arrested_in_iran_protest/), [/r/NewIran](http://np.reddit.com/r/NewIran/comments/y9wu1c/almost_12500_people_arrested_in_iran_protest/) and [/r/RedditSample](http://np.reddit.com/r/RedditSample/comments/y9wuwx/almost_12500_people_arrested_in_iran_protest/).

*NOTICE*: This thread is for discussing the submission topic. Please do not discuss the concept of the [autotldr](http://www.reddit.com/user/autotldr) bot here.",https://www.reddit.com/r/autotldr/comments/y9y3k7/almost_12500_people_arrested_in_iran_protest/,1666369856.0
xz5j32,AMA,"I'm an Iranian living in Iran, AMA about Iran protests",840,264,"First of all, you might be wondering why I have access to Reddit, since they have cut off our access to Instagram, WhatsApp, and many other social media platforms. Reddit is not that popular in Iran, and I believe this is why they didn't consider it ""threatening"" enough to filter. 

Today was an important day for the Iranians, as many (MANY) people in a vast majority of the cities have come to the streets to protest, and Tajrish Bazaar in Tehran (plus many stores in various parts of the country) have gone on strike. 

As an added bonus, the 21:00 IRIB news was attacked by a hacktivist group called ""Edaalat-e Ali"" with a picture of Khamenei in flames and pictures of the regime's victims being displayed on national TV for a few seconds. 

So, that's what happened on day 22 of the protests. Now, ask me anything you want to know about the protests and I'll try to explain everything best I can. 

Please be kind (not towards the IR!) and note that the internet situation is quite sh*tty here, so I may not be able to answer you ASAP.

Edit: If you'd like to help, you can sign [this petition](https://www.change.org/p/petition-to-deport-and-or-seize-assets-of-islamic-republic-relatives-and-extended-relatives-in-canada?recruiter=361275376&utm_source=share_petition&utm_campaign=psf_combo_share_initial&utm_medium=whatsapp&utm_content=washarecopy_34542355_en-CA%3A1&recruited_by_id=637120a0-42aa-11e5-8ee6-03722aa2e147&share_bandit_exp=initial-34542355-en-CA) to deport and/or seize assets of the IR relatives in Canada. I have talked about this in the comments.

2nd edit: you can check out r/NewIran for pictures and videos of what's happening in my country.",https://www.reddit.com/r/AMA/comments/xz5j32/im_an_iranian_living_in_iran_ama_about_iran/,1665268297.0
y71ctj,worldnews,"Iran protests: Government uses internet ‘kill-switch’ as tech savvy youth continue to evade digital censorship | Iran rolls out its internet “kill-switch” for the first time, as #MahsaAmini becomes the most popular hashtag in the world.",1861,77,,https://news.sky.com/story/iran-protests-government-uses-internet-kill-switch-as-tech-savvy-youth-continue-to-evade-digital-censorship-12723012,1666082867.0
y9cexc,u_SpecialistFold,Teenage boy shot dead at Iran protest - sources - BBC News,1,0,,https://www.bbc.com/news/world-middle-east-63328086.amp,1666305885.0
xog81a,MensRights,"Iran protests for women's rights: Men taking most of the risks, as usual. Less than 1/10 of the arrested are women.",754,517,"[Over 700 protesters, including 60 women, arrested in Iran, police say](https://english.alarabiya.net/News/middle-east/2022/09/24/Over-700-protesters-including-60-women-arrested-in-Iran-police-say)

Shows how much they depend on men. They can't even fight for their own rights.

And after men fight and provide them with rights like the West, the 'strong, independent women' will not need men anymore, and suddenly 'all men are bad'.

The Iranian men should hang back and let these strong independent queens earn their own rights.",https://www.reddit.com/r/MensRights/comments/xog81a/iran_protests_for_womens_rights_men_taking_most/,1664190532.0
y9ycuh,NoFilterNews,/r/worldnews - https://www.theguardian.com/world/2022/oct/21/arrests-iran-protest-crackdown-plight-thousands-in-jail,1,0,"/r/worldnews
   
 https://www.theguardian.com/world/2022/oct/21/arrests-iran-protest-crackdown-plight-thousands-in-jail",https://www.reddit.com/r/NoFilterNews/comments/y9ycuh/rworldnews/,1666370519.0
xkxs9u,196,iran protests NEW UPDATE SEP 22 RULE!!!!,6470,106,,https://i.redd.it/4p1flw4w1ep91.jpg,1663843060.0
yc86y2,nextfuckinglevel,Iran Protests: Women dancing to street music in an act of defiance,2995,60,,https://v.redd.it/elbqnlmmiqv91,1666609002.0
xro1yt,worldnews,"Iran protests over young woman's death continue, 83 said killed",4391,155,,https://www.reuters.com/world/middle-east/iran-protests-over-young-womans-death-continue-83-said-killed-2022-09-29/,1664499480.0
yf79u6,NoFilterNews,/r/worldnews - https://www.washingtonpost.com/world/2022/10/27/iran-protest-mahabad-mahsa-amini/,1,0,"/r/worldnews
   
 https://www.washingtonpost.com/world/2022/10/27/iran-protest-mahabad-mahsa-amini/",https://www.reddit.com/r/NoFilterNews/comments/yf79u6/rworldnews/,1666914113.0
xk3112,196,iran protests UPDATE please read rule!!!!,7679,173,,https://i.redd.it/6w9nswxgc7p91.png,1663761863.0
ya43ao,NoFilterNews,/r/news - https://www.theguardian.com/world/2022/oct/21/arrests-iran-protest-crackdown-plight-thousands-in-jail,1,0,"/r/news
   
 https://www.theguardian.com/world/2022/oct/21/arrests-iran-protest-crackdown-plight-thousands-in-jail",https://www.reddit.com/r/NoFilterNews/comments/ya43ao/rnews/,1666384736.0
yeufkh,WitchesVsPatriarchy,A woman argues with Basij militia members after removing her hijab during Iran protests,3076,31,,https://i.redd.it/n6izl16g6dw91.jpg,1666883351.0
y15udg,worldnews,Twenty-Four Days and Counting: Iran Protests See Ongoing Killings and Threats,3338,114,,https://iranwire.com/en/politics/108490-twenty-four-days-and-counting-iran-protests-see-ongoing-killings-and-threats/,1665485191.0
y0pgmp,worldnews,"Energy workers join Iran protests, endangering regime’s coffers",2580,91,,https://www.timesofisrael.com/energy-workers-join-iran-protests-endangering-regimes-coffers/,1665434485.0
y57swc,NoFilterNews,/r/worldnews - https://www.cnn.com/2022/10/15/world/evin-prison-tehran-iran-protest/index.html,1,0,"/r/worldnews
   
 https://www.cnn.com/2022/10/15/world/evin-prison-tehran-iran-protest/index.html",https://www.reddit.com/r/NoFilterNews/comments/y57swc/rworldnews/,1665895315.0
xlrj4e,trendinghot,"Iran protest, women burning hijabs and cutting hair to fight against the dictators",2,0,,https://www.reddit.com/r/pics/comments/xlr54v/iran_protest_women_burning_hijabs_and_cutting/?utm_source=ifttt,1663921061.0
xtxlf5,DemocraticUnderground,Swiss police violently disperse anti-Iran protest at embassy,1,0,,https://www.democraticunderground.com/10142976479,1664739245.0
xv4s56,autotldr,Swiss police violently disperse anti-Iran protest at embassy,1,0,"This is the best tl;dr I could make, [original](https://us.yahoo.com/news/swiss-police-violently-disperses-anti-095819904.html) reduced by 14%. (I'm a bot)
*****
> BERLIN - Swiss police used rubber bullets to disperse protesters in front of the Iranian Embassy in Bern after two men climbed over the embassy&#039;s fence and pulled down the Iranian flag from a flagpole in the yard.

> Police said late Saturday that nobody was injured and that the &quot;Large crowd&quot; of protesters was dispersed after the use of rubber bullets.

> The two protesters who entered the embassy&#039;s grounds were detained, according to police in the Swiss capital.

> Police said they used rubber bullets after several other protesters at the unauthorized demonstration tried following the two men who had first entered the embassy&#039;s yard and also attempted to access the premises.

> Thousands of Iranians have taken to the streets over the last two weeks in protests over the death of Mahsa Amini, a 22-year-old woman who had been detained by the morality police in the capital, Tehran, for allegedly wearing her mandatory Islamic headscarf too loosely.

> Outside of Iran, thousands of protesters have also staged demonstrations in European countries and elsewhere over the death of Amini.


*****
[**Summary Source**](https://smmry.com/https://us.yahoo.com/news/swiss-police-violently-disperses-anti-095819904.html) | [FAQ](http://autotldr.io/ ""606734 summaries so far."") | [Feedback](http://www.reddit.com/message/compose?to=%23autotldr ""PM's and comments are monitored, constructive feedback is welcome."") | *Top* *keywords*: **protests**^#1 **over**^#2 **police**^#3 **Embassy**^#4 **two**^#5

Post found in [/r/worldnews](http://np.reddit.com/r/worldnews/comments/xv45f3/swiss_police_violently_disperse_antiiran_protest/), [/r/GlobalNews](http://np.reddit.com/r/GlobalNews/comments/xv45u3/swiss_police_violently_disperse_antiiran_protest/) and [/r/iran](http://np.reddit.com/r/iran/comments/xv45l3/swiss_police_violently_disperse_antiiran_protest/).

*NOTICE*: This thread is for discussing the submission topic. Please do not discuss the concept of the [autotldr](http://www.reddit.com/user/autotldr) bot here.",https://www.reddit.com/r/autotldr/comments/xv4s56/swiss_police_violently_disperse_antiiran_protest/,1664856028.0
y0qem8,u_VoteOurVoice,"Children among 185 killed during Iran protest unrest, rights group says.",1,0,,https://www.axios.com/2022/10/10/iran-protest-unrest-children-among-dead,1665436767.0
xu15ns,u_Giganticeastwood198,Iran Protests 2022 | Iran's Anti-Hijab Protest Spread Across World | LIVE News | Iran Protest Video,2,0,,https://www.youtube.com/watch?v=ChKkMPZTvRk,1664747990.0
xp5b6b,AutoNewspaper,"[World] - Iran protest death toll tops 75 as crackdown intensifies, rights group says | The Japan Times",1,0,,https://www.japantimes.co.jp/news/2022/09/27/world/iran-protest-death-toll/,1664249728.0
y9wuwx,RedditSample,"Almost 12,500 people arrested in Iran protest crackdown, says rights group",1,0,,https://www.theguardian.com/world/2022/oct/21/arrests-iran-protest-crackdown-plight-thousands-in-jail,1666366706.0
xnyqng,SeenOnNews_longtail,French Police Use Tear Gas To Thwart Iran Protest In Paris [#64|+35|c7],1,2,,https://www.barrons.com/news/french-police-use-tear-gas-to-thwart-iran-protest-in-paris-01664129109,1664139179.0
